{"capabilities":[{"bounded_workflow_for":["state_hypothesis"],"candidate_outputs":["capability_candidate","bounded_workflow_review_candidate"],"capability_id":"agon.capability.epistemic.hypothesis_stance_packet_draft","forbidden_effects":["live_verdict_authority","durable_scar_write","retention_execution","rank_mutation","trust_mutation","tree_of_sophia_promotion","kag_promotion","hidden_scheduler_action","assistant_contestant_drift","auto_doctrine_rewrite"],"live_protocol":false,"owner_repo":"aoa-skills","runtime_effect":"candidate_only","status":"requested_only_candidate","trigger_boundary":"future epistemic Agon packet or playbook request only"},{"bounded_workflow_for":["predict_other_model"],"candidate_outputs":["capability_candidate","bounded_workflow_review_candidate"],"capability_id":"agon.capability.epistemic.model_prediction_packet_draft","forbidden_effects":["live_verdict_authority","durable_scar_write","retention_execution","rank_mutation","trust_mutation","tree_of_sophia_promotion","kag_promotion","hidden_scheduler_action","assistant_contestant_drift","auto_doctrine_rewrite"],"live_protocol":false,"owner_repo":"aoa-skills","runtime_effect":"candidate_only","status":"requested_only_candidate","trigger_boundary":"future epistemic Agon packet or playbook request only"},{"bounded_workflow_for":["attack_inference_chain"],"candidate_outputs":["capability_candidate","bounded_workflow_review_candidate"],"capability_id":"agon.capability.epistemic.inference_chain_review_workflow","forbidden_effects":["live_verdict_authority","durable_scar_write","retention_execution","rank_mutation","trust_mutation","tree_of_sophia_promotion","kag_promotion","hidden_scheduler_action","assistant_contestant_drift","auto_doctrine_rewrite"],"live_protocol":false,"owner_repo":"aoa-skills","runtime_effect":"candidate_only","status":"requested_only_candidate","trigger_boundary":"future epistemic Agon packet or playbook request only"},{"bounded_workflow_for":["revise_concept_map"],"candidate_outputs":["capability_candidate","bounded_workflow_review_candidate"],"capability_id":"agon.capability.epistemic.concept_delta_receipt_workflow","forbidden_effects":["live_verdict_authority","durable_scar_write","retention_execution","rank_mutation","trust_mutation","tree_of_sophia_promotion","kag_promotion","hidden_scheduler_action","assistant_contestant_drift","auto_doctrine_rewrite"],"live_protocol":false,"owner_repo":"aoa-skills","runtime_effect":"candidate_only","status":"requested_only_candidate","trigger_boundary":"future epistemic Agon packet or playbook request only"},{"bounded_workflow_for":["propose_bifurcation"],"candidate_outputs":["capability_candidate","bounded_workflow_review_candidate"],"capability_id":"agon.capability.epistemic.bifurcation_proposal_workflow","forbidden_effects":["live_verdict_authority","durable_scar_write","retention_execution","rank_mutation","trust_mutation","tree_of_sophia_promotion","kag_promotion","hidden_scheduler_action","assistant_contestant_drift","auto_doctrine_rewrite"],"live_protocol":false,"owner_repo":"aoa-skills","runtime_effect":"candidate_only","status":"requested_only_candidate","trigger_boundary":"future epistemic Agon packet or playbook request only"},{"bounded_workflow_for":["compare_explanatory_power"],"candidate_outputs":["capability_candidate","bounded_workflow_review_candidate"],"capability_id":"agon.capability.epistemic.explanatory_comparison_workflow","forbidden_effects":["live_verdict_authority","durable_scar_write","retention_execution","rank_mutation","trust_mutation","tree_of_sophia_promotion","kag_promotion","hidden_scheduler_action","assistant_contestant_drift","auto_doctrine_rewrite"],"live_protocol":false,"owner_repo":"aoa-skills","runtime_effect":"candidate_only","status":"requested_only_candidate","trigger_boundary":"future epistemic Agon packet or playbook request only"},{"bounded_workflow_for":["mark_epistemic_rupture"],"candidate_outputs":["capability_candidate","bounded_workflow_review_candidate"],"capability_id":"agon.capability.epistemic.rupture_dossier_workflow","forbidden_effects":["live_verdict_authority","durable_scar_write","retention_execution","rank_mutation","trust_mutation","tree_of_sophia_promotion","kag_promotion","hidden_scheduler_action","assistant_contestant_drift","auto_doctrine_rewrite"],"live_protocol":false,"owner_repo":"aoa-skills","runtime_effect":"candidate_only","status":"requested_only_candidate","trigger_boundary":"future epistemic Agon packet or playbook request only"},{"bounded_workflow_for":["request_doctrine_review"],"candidate_outputs":["capability_candidate","bounded_workflow_review_candidate"],"capability_id":"agon.capability.epistemic.doctrine_revision_candidate_workflow","forbidden_effects":["live_verdict_authority","durable_scar_write","retention_execution","rank_mutation","trust_mutation","tree_of_sophia_promotion","kag_promotion","hidden_scheduler_action","assistant_contestant_drift","auto_doctrine_rewrite"],"live_protocol":false,"owner_repo":"aoa-skills","runtime_effect":"candidate_only","status":"requested_only_candidate","trigger_boundary":"future epistemic Agon packet or playbook request only"},{"bounded_workflow_for":["compare_explanatory_power"],"candidate_outputs":["capability_candidate","bounded_workflow_review_candidate"],"capability_id":"agon.capability.epistemic.false_consensus_check_workflow","forbidden_effects":["live_verdict_authority","durable_scar_write","retention_execution","rank_mutation","trust_mutation","tree_of_sophia_promotion","kag_promotion","hidden_scheduler_action","assistant_contestant_drift","auto_doctrine_rewrite"],"live_protocol":false,"owner_repo":"aoa-skills","runtime_effect":"candidate_only","status":"requested_only_candidate","trigger_boundary":"future epistemic Agon packet or playbook request only"}],"count":9,"digest":"9cba9eb82e8e493ba79ec7d20e3fd984881472fc30f8a5f3f17b7e717614ed69","registry_id":"agon.epistemic_capability_candidates.registry.v1","runtime_posture":"candidate_only","wave":"XV"}
